{"change_id":"fix-spec-granular-availability-audit","objective":"Corregir en la especificación vigente las dos inconsistencias residuales detectadas por la auditoría, manteniendo la semántica de OMIT y la trazabilidad de los 46 requisitos.","decisions":[{"id":"D-001","decision":"Tratar OMIT como exclusión total del insumo base identificado; no introducir omisión parcial."},{"id":"D-002","decision":"Actualizar tanto el enlace del índice como el ancla explícita de la sección 14.1 para identificar REQ-MENU-001 a REQ-MENU-046."},{"id":"D-003","decision":"Incrementar la versión del documento a 1.1.4 y registrar únicamente estas correcciones, conservando las referencias históricas anteriores."}],"invariants":["Solo docs/md/spec.md puede modificarse.","La disponibilidad continúa calculándose sobre StockRemanente después de aplicar OMIT y antes de ADD.","OMIT elimina por completo el insumo base correspondiente; no admite reducción parcial de cantidad.","No se modifican ownership, contratos, modelo comercial ni requisitos ajenos a las correcciones auditadas.","No se sincronizan traducciones, documentos históricos ni artefactos derivados."],"affected_files":[{"path":"docs/md/spec.md","operation":"MODIFY","instructions":["Reescribir el caso de verificación 3 de REQ-MENU-044 para que una directiva OMIT sobre la base de 100 g produzca BaseNetoTrasOMIT = 0, no 50 g.","En ese caso, conservar StockDisponible = 120 g, declarar configuredMaxQuantity = 3 y recalcular StockRemanente = 120 g, evaluatedCapacity = floor(120 / 50) = 2 y availableMaxQuantity = min(3, 2) = 2.","Eliminar del caso cualquier expresión que permita interpretar OMIT como una reducción parcial del ingrediente.","Cambiar el href del índice de la sección 14.1 y su ancla HTML explícita a 141-trazabilidad-de-requisitos-funcionales-req-menu-001-a-req-menu-046, manteniendo iguales el texto visible y el título ya correctos.","Actualizar la versión vigente de 1.1.3 a 1.1.4 y añadir en la sección 2.1 una nota breve que atribuya a 1.1.4 la corrección del caso OMIT y del ancla de trazabilidad.","Añadir v1.1.4 únicamente a la trazabilidad de REQ-MENU-044 y a su fila en la matriz; no reetiquetar como v1.1.4 aclaraciones no modificadas."] ,"acceptance":["El caso OMIT de REQ-MENU-044 usa BaseNetoTrasOMIT = 0 y sus resultados numéricos son StockRemanente = 120 g, evaluatedCapacity = 2 y availableMaxQuantity = 2.","No queda ningún ejemplo que presente OMIT como reducción parcial de 100 g a 50 g.","El enlace del índice de 14.1 resuelve exactamente al ancla explícita terminada en req-menu-046.","No permanece como ancla canónica ni como href el identificador terminado en req-menu-041.","El encabezado, la configuración y la trazabilidad pertinente identifican coherentemente la versión 1.1.4 sin alterar referencias históricas no afectadas.","La matriz sigue declarando exactamente 46 requisitos, desde REQ-MENU-001 hasta REQ-MENU-046.","El diff se limita a docs/md/spec.md y supera git diff --check."]}],"blockers":[]}