{"change_id":"normalize-menu-requirement-identifiers","objective":"Normalizar en docs/md/spec.md los 46 identificadores funcionales de Menu por apartado, actualizar todas sus referencias internas y conservar intacto el significado normativo.","decisions":[{"id":"abbreviations","decision":"Usar un conjunto mínimo de 11 abreviaciones, una por apartado funcional vigente: ITM (4.1), VAR (4.2), PRC (4.3), FUL (4.4), MOD (4.5), COM (4.6), LIF (4.7), ING (4.8), VER (4.9), REV (4.10) y AVL (4.11)."},{"id":"mapping","decision":"Aplicar este mapa completo por orden de aparición: 001→ITM-001, 002→ITM-002; 003→VAR-001, 004→VAR-002, 023→VAR-003, 005→VAR-004, 032→VAR-005, 039→VAR-006; 006→PRC-001, 007→PRC-002, 029→PRC-003; 008→FUL-001, 009→FUL-002, 020→FUL-003, 021→FUL-004; 013→MOD-001, 014→MOD-002, 015→MOD-003, 016→MOD-004, 017→MOD-005, 018→MOD-006, 019→MOD-007, 038→MOD-008; 010→COM-001, 011→COM-002, 012→COM-003, 024→COM-004, 025→COM-005, 040→COM-006; 026→LIF-001, 027→LIF-002, 028→LIF-003; 030→ING-001; 031→VER-001; 033→REV-001, 034→REV-002, 035→REV-003, 036→REV-004, 037→REV-005; 022→AVL-001, 041→AVL-002, 042→AVL-003, 043→AVL-004, 044→AVL-005, 045→AVL-006 y 046→AVL-007. Cada destino lleva el prefijo completo REQ-MENU-."},{"id":"document_revision","decision":"Incrementar la versión del documento de 1.1.7 a 1.1.8 y añadir en su configuración una nota limitada a esta normalización de identificadores y referencias."},{"id":"duplicate_policy","decision":"No dividir, fusionar ni eliminar requisitos. Si durante la edición se descubre una duplicidad semántica real, detenerse y reportarla antes de modificar la cantidad de requisitos."}],"invariants":["docs/md/spec.md es el único archivo modificable.","Deben permanecer exactamente 46 requisitos funcionales, con los mismos títulos, obligaciones, fuentes, verificaciones y significado.","Los identificadores BR-, INV-, NFR-, ADR-, OPEN- y demás nomenclaturas independientes deben conservarse.","La numeración comienza en 001 y es consecutiva dentro de cada abreviación según el orden de aparición.","No se sincronizan traducciones, fuentes históricas ni artefactos derivados externos."],"affected_files":[{"path":"docs/md/spec.md","operation":"MODIFY","instructions":["Aplicar el mapa OLD_ID → NEW_ID de forma global y controlada en encabezados, campos internos, texto narrativo, verificaciones, reglas, diagramas, interfaces, trazabilidad, cuestiones abiertas y cualquier otra referencia del documento.","Actualizar las 46 anclas HTML de requisitos para que sean la forma minúscula exacta del nuevo identificador y mantener correspondencia uno a uno con sus encabezados.","Reemplazar también las referencias abreviadas REQ-NNN de la matriz de ADR por los nuevos identificadores completos; no alterar abreviaturas pertenecientes a BR, INV, NFR, ADR u OPEN.","Actualizar el índice, el encabezado y el ancla de la sección 14.1. Como ya no existe un único rango numérico global, reformular los textos de rango obsoletos mediante el total de 46 requisitos y el esquema por apartados, sin inventar un rango heterogéneo.","Reformular de igual modo las menciones históricas a rangos antiguos, conservando su dato cuantitativo y sentido documental pero sin dejar identificadores obsoletos.","Actualizar las 46 filas de la matriz de trazabilidad con los nuevos IDs, sin reordenar requisitos por su numeración histórica.","Cambiar la versión a 1.1.8 y agregar una descripción concisa de la normalización en la sección de configuración del documento.","Limitar el resto del cambio a ajustes estrictamente necesarios para que las nuevas referencias, anclas y frases de rango sean correctas; no reescribir contenido normativo."] ,"acceptance":["Existen exactamente 46 encabezados funcionales y 46 anclas de requisito, todos únicos y emparejados.","Todo identificador funcional cumple REQ-MENU-{ITM|VAR|PRC|FUL|MOD|COM|LIF|ING|VER|REV|AVL}-{NNN}.","Las secuencias por abreviación son continuas desde 001, sin huecos ni duplicados, en orden de aparición.","No queda ninguna coincidencia de REQ-MENU-[0-9]{3} ni ninguna referencia abreviada REQ-[0-9]{3}.","Cada referencia REQ-MENU-XXX-NNN del documento resuelve a un encabezado existente; no hay referencias rotas.","La matriz de trazabilidad contiene exactamente una fila para cada uno de los 46 requisitos normalizados.","El documento declara la versión 1.1.8 y describe únicamente esta normalización como cambio de versión.","Los IDs independientes BR-, INV-, NFR-, ADR- y OPEN- permanecen sin renombrar.","El diff se limita a docs/md/spec.md, no altera el significado de los requisitos y supera git diff --check."]}],"blockers":[]}