{
  "change_id": "audit-spec-authorized-sources",
  "objective": "Revisar integralmente docs/md/spec.md y corregirlo para que todas sus decisiones y referencias se sustenten exclusivamente en las nueve fuentes autorizadas y en las instrucciones explícitas de esta revisión.",
  "decisions": [
    {
      "id": "D1",
      "decision": "Tratar como evidencia histórica válida únicamente Problema-Inicial.md, Consultoria-1.md, Consultoria-2.md, Auditoria-1.md, Auditoria-2.md, Modelo-Pre-Final.md, Decisiones-cierre-invariantes.md, Req-F-Aproved.md y Auditoria-3.md."
    },
    {
      "id": "D2",
      "decision": "No conservar una conclusión mediante una cita válida superficial: su contenido exacto debe poder derivarse realmente de una o más fuentes autorizadas."
    },
    {
      "id": "D3",
      "decision": "Conservar las conclusiones respaldadas por fuentes autorizadas, corrigiendo su formulación y trazabilidad cuando sea necesario; eliminar las decisiones que dependan exclusivamente de evidencia no autorizada."
    },
    {
      "id": "D4",
      "decision": "No realizar renumeración global. Los identificadores supervivientes conservarán su numeración aunque se retire contenido intermedio."
    },
    {
      "id": "D5",
      "decision": "Registrar una cuestión abierta únicamente cuando las fuentes autorizadas sustenten que el asunto permanece sin resolver; no transformar supuestos no autorizados en nuevos OPEN arbitrarios."
    }
  ],
  "invariants": [
    "Solo docs/md/spec.md puede modificarse.",
    "Las nueve fuentes autorizadas son contexto de solo lectura.",
    "No sincronizar traducciones, documentos históricos, artefactos derivados ni archivos adyacentes.",
    "No inventar requisitos, reglas, métricas, interfaces, entidades, atributos, eventos, verificaciones ni decisiones para cubrir vacíos.",
    "Mantener la prevalencia temporal entre fuentes autorizadas cuando una decisión posterior sustituya o refine otra anterior.",
    "Preservar los identificadores de requisitos, reglas, invariantes, NFR, ADR y OPEN que sobrevivan; no reasignarlos ni compactar secuencias."
  ],
  "affected_files": [
    {
      "path": "docs/md/spec.md",
      "operation": "MODIFY",
      "instructions": [
        "Auditar el documento completo, incluidas configuración y alcance, requisitos funcionales y no funcionales, reglas e invariantes, modelos y diagramas, arquitectura, modelo de datos, APIs, eventos, dependencias, cuestiones abiertas y matrices de trazabilidad.",
        "Para cada afirmación normativa o de diseño, además de sus racionales, ejemplos, criterios de verificación y filas de trazabilidad, localizar evidencia semántica real en una o más de las nueve fuentes autorizadas.",
        "Volver a determinar desde esas fuentes todo contenido sospechoso de provenir de otra fuente. Conservarlo solo si el mismo significado está respaldado; ajustar alcance, precisión, terminología y cita para que coincidan con la evidencia válida.",
        "Eliminar referencias explícitas o implícitas a fuentes no autorizadas y retirar cualquier detalle cuya única justificación provenga de ellas. No sustituirlo por una suposición ni atribuirlo falsamente a una fuente permitida.",
        "Actualizar dentro del mismo archivo las citas, explicaciones de autoridad, relaciones de trazabilidad, tablas, diagramas y referencias internas afectadas por las correcciones, sin introducir renumeración global.",
        "Si se retira por completo un elemento identificado, eliminar también sus afirmaciones duplicadas y su fila de trazabilidad, pero no reutilizar ni desplazar su identificador.",
        "Conservar los OPEN existentes solo en la medida en que su problema y límites estén respaldados por las fuentes autorizadas; no cerrar pendientes ni crear decisiones nuevas durante esta revisión.",
        "Realizar una última pasada integral para detectar decisiones repetidas en prosa, tablas o diagramas que hayan quedado desalineadas después de eliminar o reformular contenido no autorizado."
      ],
      "acceptance": [
        "docs/md/spec.md es el único archivo planificado para modificación.",
        "Toda decisión conservada puede vincularse de forma verificable con contenido de al menos una fuente autorizada o con una instrucción explícita de esta revisión.",
        "Todas las referencias documentales presentes pertenecen a la lista autorizada; no quedan nombres, enlaces ni atribuciones a fuentes externas o no habilitadas.",
        "Ninguna cita autorizada se usa para encubrir detalles que la fuente citada no establece.",
        "El contenido sustentado exclusivamente por fuentes no autorizadas fue eliminado en todas sus apariciones, incluidas tablas, diagramas y trazabilidad.",
        "Los requisitos y demás elementos supervivientes conservan sus identificadores originales y no se ejecutó renumeración global.",
        "Las referencias internas, anclas, tablas y bloques Mermaid afectados siguen siendo coherentes y sintácticamente válidos.",
        "No se modifican las nueve fuentes de evidencia ni otros artefactos del repositorio."
      ]
    }
  ],
  "blockers": []
}
