{"change_id":"normalize-menu-requirement-identifiers-audit-fix","objective":"Correct the remaining structural defect in docs/md/spec.md after requirement-identifier normalization, without altering requirement semantics or expanding scope.","decisions":[{"id":"D-001","decision":"Retain the completed identifier normalization; the prior audit confirms the required ID scheme is satisfied."},{"id":"D-002","decision":"Limit the edit to restoring the missing table-of-contents indentation for section 14.1."}],"invariants":["Only docs/md/spec.md may change.","Do not alter requirement IDs, requirement meaning, cross-references, headings, links, metadata, version, or date.","Do not divide, merge, add, or remove requirements.","Preserve identifiers belonging to independently named artifact types."],"affected_files":[{"path":"docs/md/spec.md","operation":"MODIFY","instructions":["Add exactly two leading spaces before the existing `- [14.1 Trazabilidad de Requisitos Funcionales (46 Requisitos por Apartados)](...)` table-of-contents entry so it is nested under section 14, matching entries 14.2 and 14.3.","Preserve the entry text, anchor target, surrounding content, and all normalized requirement identifiers unchanged.","Make no other edits to the file."] , "acceptance":["The section 14 table-of-contents entry remains top-level, while entries 14.1, 14.2, and 14.3 each have exactly two leading spaces.","All Menu functional-requirement IDs still match `REQ-MENU-{ABREVIACION_APARTADO}-{NNN}`.","Within every abbreviation, numbering starts at 001, is consecutive, follows document order, and contains no duplicates.","Every internal reference resolves to an existing identifier, and no superseded Menu requirement ID remains.","The Git delta contains only the two-space indentation correction in docs/md/spec.md."]}],"blockers":[]}