{"change_id":"menu-granular-availability-2026-09-16","objective":"Actualizar exclusivamente docs/md/spec.md para sustituir la disponibilidad calculada por peor caso por una estrategia operacional granular, verificable y propagada por capacidad, manteniendo intactos el dominio comercial y sus ownerships.","decisions":[{"id":"D1","decision":"Conservar REQ-MENU-041 como regla general de desacoplamiento y añadir requisitos atómicos consecutivos para requerimientos de Inventory, variantes, modificadores, configuraciones de combo y disponibilidad agregada."},{"id":"D2","decision":"Tratar la solicitud vigente del 2026-09-16 como autoridad posterior que sustituye cualquier política de disponibilidad basada en activar simultáneamente todos los modificadores opcionales."},{"id":"D3","decision":"Mantener separados maxQuantity configurado y availableMaxQuantity operacional; la disponibilidad nunca modifica la configuración comercial efectiva."},{"id":"D4","decision":"Representar la disponibilidad mediante VariantAvailability, ModifierAvailability y ComboConfigurationAvailability; derivar ComboOption, ComboSlot y MenuItem cuando no requieran materialización propia."},{"id":"D5","decision":"Conservar Inventory como propietario de existencias y evaluaciones operacionales, Menu como propietario del catálogo y Orders como propietario del ciclo de la comanda; no decidir protocolos, tópicos ni payloads físicos abiertos en OPEN-007."},{"id":"D6","decision":"Incrementar la versión documental de 1.0.0 a 1.1.0 por el cambio semántico compatible y conservar la fecha 2026-09-16."}],"invariants":["Una MenuItemVariant PREPARED o STOCKED permanece AVAILABLE mientras exista al menos una configuración válida satisfacible con el inventario actual.","La indisponibilidad de una personalización opcional bloquea o limita únicamente la ModifierOption correspondiente.","Una MenuItemVariant pasa a UNAVAILABLE cuando sus requerimientos base no son satisfacibles o cuando un ModifierGroup obligatorio carece de capacidad disponible para cumplir minSelections.","Una ComboOption deriva su disponibilidad de la MenuItemVariant hoja referenciada; una ComboConfiguration solo queda UNAVAILABLE cuando algún slot obligatorio no puede cumplir minSelections.","La disponibilidad agregada de MenuItem es derivada y no constituye estado comercial autoritativo ni fuente para bloquear unidades hijas individualmente.","La disponibilidad operacional no altera estado administrativo, elegibilidad estructural, precios, definiciones persistidas ni revisiones comerciales.","Los modificadores propios no están prohibidos en Combo: ese concepto simplemente está ausente del modelo de Combo v1.","Las evaluaciones conservan revisión de definición, revisión creciente de evaluación y validUntil; Menu descarta evaluaciones obsoletas y no republica resultados recibidos de Inventory.","No se añadirá ninguna escritura fuera de docs/md/spec.md."],"affected_files":[{"path":"docs/md/spec.md","operation":"MODIFY","instructions":["Actualizar metadatos, autoridad temporal y texto introductorio para registrar la decisión de disponibilidad granular del 2026-09-16 como refinamiento vigente; cambiar la versión a 1.1.0 sin presentar .ai/request.md como artefacto público.","Reformular REQ-MENU-013, su verificación, BR-MENU-017 y su trazabilidad para expresar que ModifierGroup y ModifierOption pertenecen al modelo de items hoja y están ausentes del modelo de Combo v1, sin describir esa ausencia como prohibición o regla negativa.","Mantener REQ-MENU-038 como proyección de configuración efectiva y aclarar que ResolvedVariantModifier aporta maxQuantity configurado; la disponibilidad y availableMaxQuantity proceden de ModifierAvailability y no sobrescriben la configuración comercial.","Revisar REQ-MENU-041 como frontera general de disponibilidad operacional desacoplada y añadir requisitos funcionales atómicos REQ-MENU-042 a REQ-MENU-046 para: publicar BaseRequirements y ModifierRequirements separados; calcular VariantAvailability; calcular ModifierAvailability y availableMaxQuantity; calcular ComboConfigurationAvailability por capacidad de slots; y derivar la disponibilidad agregada de MenuItem.","Especificar BaseRequirements de PREPARED desde la revisión de receta y de STOCKED desde inventoryItemId más cantidad de retiro. Especificar ModifierRequirements por la tupla variantId/modifierOptionId usando ResolvedVariantModifier, con referencias de Inventory y cantidades normalizadas/aplanadas. Excluir explícitamente el máximo global que suponga todos los modificadores opcionales activos.","Definir availableMaxQuantity solo cuando sea aplicable, con 0 <= availableMaxQuantity <= configuredMaxQuantity, y conservar separados enabled, maxQuantity configurado, available y availableMaxQuantity.","Añadir reglas de negocio atómicas para propagación existencial: modificador opcional agotado no bloquea variante; grupo obligatorio bloquea solo si su capacidad disponible no cubre minSelections; ComboOption hereda disponibilidad de la variante hoja; ComboSlot se evalúa por availableCapacity; ComboConfiguration requiere todos sus slots obligatorios satisfacibles; MenuItem hoja o COMBO está disponible si existe al menos una unidad hija disponible.","Actualizar glosario, modelo de dominio, diagramas y proyecciones de lectura para incorporar como mínimo VariantAvailability(variantId, available), ModifierAvailability(variantId, modifierOptionId, available, availableMaxQuantity) y ComboConfigurationAvailability(configurationId, available), conservando revisión, evaluationRevision y validUntil en cada proyección o en su envolvente de evaluación.","Corregir etiquetas existentes donde enabled se describa como disponibilidad para que represente habilitación configurada o administrativa; reservar available para disponibilidad operacional derivada de Inventory.","Actualizar CatalogItemProjection y los contratos de consulta pública para exponer disponibilidad por variante, opción de modificador con límite disponible y configuración de combo, usando isAvailable de MenuItem únicamente como agregado de presentación.","Actualizar el intercambio lógico Menu-Inventory y los eventos: Menu publica requerimientos base e incrementales separados; Inventory devuelve evaluaciones granulares y vigentes; Menu deriva y materializa las proyecciones superiores sin introducir nombres de eventos, transporte o esquemas físicos no autorizados.","Actualizar NFR-MENU-RESI-01 para que la caducidad o desconexión vuelva no disponible únicamente la unidad granular cuya evaluación perdió vigencia y propague el efecto hacia padres solo cuando ya no exista una configuración válida.","Actualizar las secciones de ownership y texto explicativo para reiterar que el cambio afecta cálculo, contrato y proyección de disponibilidad, pero no transfiere ownership ni convierte disponibilidad en estado administrativo o elegibilidad estructural.","Actualizar la matriz de trazabilidad, rangos, conteos, fuentes y referencias internas para cubrir REQ-MENU-001 a REQ-MENU-046, marcar REQ-MENU-013, REQ-MENU-038 y REQ-MENU-041 como refinados cuando corresponda, e incorporar los nuevos requisitos y reglas sin renumerar identificadores existentes."],"acceptance":["docs/md/spec.md declara versión 1.1.0 y fecha 2026-09-16.","REQ-MENU-013 y BR-MENU-017 expresan ausencia del concepto en Combo, no una prohibición.","No permanece ninguna regla que determine la disponibilidad de una variante mediante el peor caso de todos sus modificadores opcionales.","Los requisitos distinguen inequívocamente elegibilidad estructural, habilitación configurada y disponibilidad operacional.","PREPARED y STOCKED tienen requerimientos base definidos; los modificadores tienen requerimientos incrementales separados y normalizados.","VariantAvailability, ModifierAvailability y ComboConfigurationAvailability aparecen tanto en el modelo/proyecciones como en contratos e interfaces aplicables.","ModifierAvailability incluye availableMaxQuantity cuando aplica y nunca excede maxQuantity configurado.","Una opción opcional agotada no bloquea la variante; un grupo obligatorio insuficiente sí la vuelve no disponible.","ComboOption, ComboSlot, ComboConfiguration y MenuItem siguen la propagación por capacidad y existencia descrita en la solicitud.","La consulta de catálogo permite a la UI bloquear o limitar opciones individuales sin bloquear indebidamente variantes o configuraciones completas.","Las revisiones de definición/evaluación, validUntil, descarte de evaluaciones obsoletas y prohibición de republicar resultados de Inventory permanecen documentados.","Los ownerships de Menu, Inventory y Orders no cambian y OPEN-007 continúa abierto para decisiones técnicas no proporcionadas.","Los encabezados y anchors REQ son únicos; la matriz cubre sin huecos REQ-MENU-001 a REQ-MENU-046; no hay referencias internas obsoletas al total anterior de 41 requisitos.","La única diferencia de Git producida por la edición corresponde a docs/md/spec.md."]}],"blockers":[]}