{"change_id":"spec-availability-granularity-audit-fixes-v1.1.2","objective":"Corregir en docs/md/spec.md las contradicciones y ambigüedades restantes de la disponibilidad granular, manteniendo separadas la disponibilidad operacional, la habilitación administrativa y la elegibilidad estructural, sin ampliar el alcance a otros artefactos.","decisions":[{"id":"D-001","decision":"ModifierAvailability solo evita propagar indisponibilidad a VariantAvailability cuando la opción sea opcional o el grupo conserve capacidad suficiente; de lo contrario se reevalúa la existencia de una configuración completa satisfacible."},{"id":"D-002","decision":"evaluatedCapacity representa una cantidad lógica entera de selecciones completas de una ModifierOption, calculada después de normalizar y agregar sus efectos por artículo de Inventory; los efectos ADD consumidores determinan la capacidad limitante y OMIT se aplica antes de ADD."},{"id":"D-003","decision":"availableMaxQuantity=null se reserva para ausencia real de una derivación cuantitativa fiable; en la capacidad de un grupo, una opción disponible con valor null aporta su maxQuantity configurado, mientras una opción no disponible aporta cero."},{"id":"D-004","decision":"ComboOption.available permanece como señal operacional heredada de VariantAvailability, pero availableCapacity cuenta únicamente opciones realmente seleccionables: habilitadas, estructuralmente elegibles y operacionalmente disponibles."},{"id":"D-005","decision":"La capacidad operacional de ComboSlot es el número de ComboOption seleccionables, porque cada opción puede elegirse como máximo una vez; ComboOption.quantity no incrementa esa capacidad."},{"id":"D-006","decision":"Se conserva el ancla histórica explícita de la sección 14.1 terminada en req-menu-041, aunque el texto visible continúe indicando el rango vigente hasta REQ-MENU-046."}],"invariants":["Solo puede modificarse docs/md/spec.md.","No se modificarán AGENTS.md, .ai/**, .agents/**, scripts/** ni otros artefactos.","Los modificadores propios permanecen ausentes del modelo de Combo v1; no se formulará esa ausencia como una prohibición de dominio.","La disponibilidad operacional no se convertirá en estado administrativo ni en elegibilidad estructural.","Menu conserva el ownership comercial y Inventory conserva el ownership de existencias y evaluaciones operacionales.","BaseRequirements y ModifierRequirements permanecen separados; no se reintroducirá el cálculo global de peor caso con todos los modificadores opcionales activos.","No se inventarán contratos físicos de transporte, eventos o campos externos que continúan abiertos bajo OPEN-007."],"affected_files":[{"path":"docs/md/spec.md","operation":"MODIFY","instructions":["Actualizar la configuración del documento a la versión 1.1.2 y ajustar su descripción de versión para identificar estas aclaraciones, sin alterar la fecha ni reescribir el historial previo innecesariamente.","Corregir REQ-MENU-044, su verificación y BR-MENU-021/022 para limitar la no propagación al caso opcional o con capacidad remanente suficiente. Declarar que toda reducción de capacidad obliga a reevaluar VariantAvailability y que la variante pasa a no disponible cuando no exista una configuración completa válida y satisfacible.","Definir evaluatedCapacity de manera implementable como número entero y adimensional de selecciones completas de una opción. Especificar la normalización de unidades, la agregación de efectos del mismo inventoryItemId, la aplicación de OMIT antes de ADD y el uso del requerimiento consumidor limitante cuando existan varios efectos ADD. Para combinaciones OMIT/ADD, OMIT modifica la base y los ADD normalizados determinan la capacidad cuantitativa.","Reservar evaluatedCapacity/availableMaxQuantity=null para casos donde no exista una derivación cuantitativa fiable. Definir para cada opción la capacidad aportada al grupo: cero cuando esté deshabilitada o available=false; availableMaxQuantity cuando no sea null; configuredMaxQuantity cuando available=true y availableMaxQuantity sea null. Usar la suma de esas capacidades para comprobar minSelections, manteniendo las cantidades físicas de Inventory separadas de las unidades lógicas de selección.","Propagar esta semántica coherentemente por el glosario, REQ-MENU-042..044, reglas de negocio, modelo de dominio y read models, contrato lógico con Inventory, interfaces de catálogo, eventos consumidos, tabla de ownership, diagramas explicativos y filas de trazabilidad afectadas.","Corregir REQ-MENU-045 y BR-MENU-023/024 para conservar ComboOption.available como señal operacional heredada, pero definir un predicado separado de opción seleccionable que exija ComboOption.enabled=true, variante hoja estructuralmente elegible y VariantAvailability.available=true.","Definir availableCapacity de ComboSlot como el conteo de opciones seleccionables. Aclarar que cada ComboOption aporta como máximo una selección, independientemente de ComboOption.quantity, y que una ComboConfiguration está disponible solo cuando cada slot obligatorio alcanza minSelections con opciones seleccionables.","Alinear con esa definición el glosario, ComboConfigurationAvailability, interfaces de catálogo, diagramas y trazabilidad, sin fusionar las capacidades estructurales de INV-MENU-005 con la capacidad operacional.","Conservar el ancla explícita original `141-trazabilidad-de-requisitos-funcionales-req-menu-001-a-req-menu-041`; actualizar el enlace del índice para apuntar a ella y mantener el encabezado visible con el rango REQ-MENU-001 a REQ-MENU-046.","Mantener REQ-MENU-013 y sus textos relacionados expresando que los modificadores propios están ausentes del modelo de Combo v1, nunca que estén prohibidos.","Actualizar las notas de trazabilidad de los requisitos y reglas aclarados para referenciar la versión 1.1.2 sin eliminar la procedencia histórica existente."],"acceptance":["El único delta de escritura corresponde a docs/md/spec.md.","REQ-MENU-044 ya no afirma incondicionalmente que bloquear o limitar una opción nunca afecta VariantAvailability.","La capacidad de grupos obligatorios es calculable tanto cuando availableMaxQuantity es entero como cuando es null.","evaluatedCapacity tiene unidad lógica, reglas de normalización y agregación, y semántica definida para múltiples efectos y combinaciones OMIT/ADD.","availableCapacity de ComboSlot cuenta exclusivamente opciones habilitadas, elegibles y disponibles, sin contar ComboOption.quantity como selecciones adicionales.","REQ-MENU-043..045, BR-MENU-021..024, glosario, read models, interfaces, eventos, ownership, diagramas y trazabilidad no se contradicen.","La disponibilidad operacional permanece separada del estado administrativo y de la elegibilidad estructural.","No queda ninguna regla vigente que determine disponibilidad mediante el peor caso de todos los modificadores opcionales simultáneos.","REQ-MENU-013 describe ausencia del concepto en Combo, no una regla prohibitiva.","El ancla histórica de la sección 14.1 termina en req-menu-041 y tanto el índice como la navegación interna apuntan correctamente a ella.","La versión visible y la configuración interna del documento indican 1.1.2.","La numeración REQ-MENU-001..046 permanece estable, sin duplicados ni referencias colgantes, y `git diff --check` no reporta errores."]}],"blockers":[]}