{"change_id":"menu-spec-audit-remediation","objective":"Corregir docs/md/spec.md para que sea una especificación consolidada, coherente y trazable del servicio Menu, resolviendo exclusivamente los defectos del audit anterior mediante las nueve fuentes autorizadas y sin inventar contratos ni decisiones técnicas.","decisions":[{"id":"D-01","decision":"Aplicar prioridad temporal: ADR-001 sustituye la obligación anterior de que Menu republice resultados de disponibilidad. Inventory publica las evaluaciones; Menu las consume y expone su estado, mientras el mecanismo de invalidación hacia otros consumidores permanece en OPEN-007."},{"id":"D-02","decision":"Conservar únicamente semánticas de eventos respaldadas. Eliminar M-01..M-06, INV-01/02 y nombres o payloads técnicos inventados; M-07 solo puede conservarse con el alcance explícito de Req-F-Aproved.md, sin contrato técnico añadido."},{"id":"D-03","decision":"Sustituir el pseudo-DDL normativo por un modelo lógico y tecnológicamente neutral que documente información, relaciones y validaciones necesarias, dejando tipos físicos, longitudes, almacenamiento decimal, reglas de borrado y transporte abiertos."},{"id":"D-04","decision":"No crear docs/md/decisiones.md: la corrección no adoptará decisiones nuevas sin respaldo; toda indeterminación continuará como cuestión abierta."}],"invariants":["El único archivo writable es docs/md/spec.md y ya existe, por lo que la operación es MODIFY.","Problema-Inicial.md, Consultoria-1.md, Consultoria-2.md, Auditoria-1.md, Auditoria-2.md, Modelo-Pre-Final.md, Decisiones-cierre-invariantes.md, Req-F-Aproved.md y Auditoria-3.md son fuentes de solo lectura.","Req-F-Aproved.md es la base funcional; las decisiones posteriores incompatibles, especialmente Decisiones-cierre-invariantes.md y Auditoria-3.md, prevalecen.","No se incorporarán fuentes, contratos, métricas, tipos físicos, dependencias ni supuestos ajenos a los documentos autorizados.","Requisitos, reglas, modelo de dominio, modelo de datos, diagramas, interfaces, eventos, dependencias, abiertos y trazabilidad deberán describir el mismo modelo vigente."],"affected_files":[{"path":"docs/md/spec.md","operation":"MODIFY","instructions":["Corregir REQ-MENU-022, REQ-MENU-041, arquitectura, diagramas y eventos para expresar un solo flujo de disponibilidad: Menu publica cambios de definición de insumos; Inventory publica evaluaciones con revisión y validUntil; Menu consume evaluaciones vigentes y no republica el resultado recibido. Mantener en OPEN-007 cualquier contrato de invalidación, transporte, nombre o payload no resuelto.","Reescribir la sección de eventos eliminando M-01..M-06, INV-01/02 y nombres/payloads técnicos no respaldados. Conservar solamente eventos o intercambios lógicos demostrables en las fuentes, sin convertir ejemplos en contratos normativos.","Restituir REQ-MENU-037 completo: baseOptionIds, suma saved con los MenuItemVariant.unitPrice fijados multiplicados por ComboOption.quantity, suma current de los mismos componentes con precios actuales, difference = current - saved y carácter exclusivamente informativo. Reflejar en dominio y modelo lógico la información histórica necesaria para conservar saved, sin inventar un contrato de red ni un tipo físico.","Corregir el modelo y el Mermaid mediante subtipos o restricciones explícitas: solo PREPARED y STOCKED poseen MenuItemVariant; COMBO posee ComboConfiguration. Representar las cardinalidades confirmadas de configuraciones y slots, y no imponer un mínimo no respaldado de ComboOption; permitir definiciones incompletas INACTIVE y expresar por separado las condiciones de elegibilidad ACTIVE.","Añadir la regla completa de ModifierGroup: cada cantidad seleccionada respeta el maxQuantity efectivo de VariantModifierConfig o generalConfig, y minSelections <= suma de cantidades seleccionadas <= maxSelections. Documentar la capacidad previa a activación y la revalidación de estos límites al confirmar la línea, respetando el ownership externo de Orders.","Reemplazar el pseudo-DDL por un modelo lógico neutral. Documentar explícitamente cómo se validan, en una operación consistente, un máximo de un VariantValue por dimensión, pertenencia de valores y dimensiones al mismo MenuItem, unicidad de la combinación de variante y referencia a una revisión exacta e inmutable de Recipe.","Eliminar afirmaciones de que los índices o llaves actuales garantizan invariantes que el esquema mostrado no implementa. Distinguir restricciones lógicas o validaciones de dominio/aplicación de mecanismos físicos aún no decididos.","Eliminar NUMERIC con precisión fija, longitudes VARCHAR, TIMESTAMP, JSONB, CASCADE/RESTRICT, defaults de base de datos y cualquier otra elección física no respaldada. Mantener en OPEN-010 los tipos decimales, rangos máximos y longitudes pendientes.","Mantener ItemCategory y ComboCategory como conceptos separados cuando corresponda, pero eliminar la obligatoriedad de asignar categorías si las fuentes no la establecen. Presentar DEFAULT ComboConfiguration únicamente como posibilidad conceptual, no como creación o requisito obligatorio.","Depurar dependencias externas: eliminar Terminal ID/cabeceras, transporte RPC o síncrono impuesto y referencias no respaldadas a Billing. No presentar el snapshot conservado por Orders como dato requerido por Menu; conservar solamente ownership y flujos lógicos respaldados.","Corregir NFR-MENU-PERF-03 para no exigir recuperación inmediata de colas. Mantener las condiciones confirmadas de ráfaga, persistencia, contabilización y reintento sin duplicidad, declarando que no existe un plazo de recuperación establecido.","Actualizar glosario, tablas, diagramas, interfaces, cuestiones abiertas, índice y matriz de trazabilidad dentro del mismo archivo para reflejar las correcciones, sin narrar innecesariamente la evolución histórica."] ,"acceptance":["docs/md/spec.md es el único archivo modificado.","No aparecen M-01..M-06 ni INV-01/02 como contratos normativos, ni nombres o payloads de eventos sin respaldo explícito.","REQ-MENU-022, REQ-MENU-041, la arquitectura y los diagramas coinciden en que Inventory produce la evaluación de disponibilidad y Menu no republica ese resultado.","REQ-MENU-037 contiene baseOptionIds, quantity, saved, current y difference = current - saved, y el modelo lógico conserva la información histórica necesaria.","El modelo estructural no asigna MenuItemVariant a COMBO y no impone una cardinalidad mínima de ComboOption ausente de las fuentes.","La especificación contiene tanto el límite individual efectivo de modificadores como la desigualdad completa sobre la suma seleccionada y su validación en runtime.","El modelo lógico explica la validación de pertenencia, unicidad de dimensión/combinación y referencia exacta de Recipe sin afirmar garantías inexistentes.","No quedan precisiones NUMERIC, longitudes VARCHAR, TIMESTAMP, JSONB, CASCADE/RESTRICT ni defaults físicos presentados como decisiones vigentes; OPEN-010 permanece coherente.","DEFAULT ComboConfiguration y la asignación de categorías no se presentan como obligaciones.","No quedan Terminal ID, cabeceras, RPC/sincronía impuesta, Billing como dependencia ni snapshots de Orders clasificados como entradas requeridas por Menu.","NFR-MENU-PERF-03 no establece recuperación inmediata ni otro plazo de recuperación no respaldado.","Los enlaces del índice, anclas, identificadores y trazabilidad interna siguen siendo consistentes, y los Mermaid coinciden con el texto.","La validación es documental y de consistencia de la especificación; no se declara aceptación de implementación o runtime."]}],"blockers":[]}