{
  "change_id": "menu-granular-availability-audit-fixes",
  "objective": "Corregir en docs/md/spec.md las dos brechas restantes de la disponibilidad granular: evaluar VariantAvailability sobre configuraciones efectivas válidas con precedencia OMIT antes de ADD, y completar el contrato lógico Inventory → Menu con la capacidad necesaria para derivar availableMaxQuantity.",
  "decisions": [
    {
      "id": "D1",
      "decision": "Modificar únicamente docs/md/spec.md; el archivo ya existe y ningún otro artefacto forma parte del alcance autorizado."
    },
    {
      "id": "D2",
      "decision": "Una variante estará disponible si existe al menos una configuración completa válida y satisfacible; los OMIT se aplican a BaseRequirements antes de incorporar los ADD de los modificadores seleccionados."
    },
    {
      "id": "D3",
      "decision": "La evaluación lógica de Inventory incluirá una capacidad cuantitativa opcional. Cuando aplique, Menu derivará availableMaxQuantity como el mínimo entre esa capacidad y configuredMaxQuantity; cuando no aplique, se representará como nulo/no aplicable, distinto de cero."
    },
    {
      "id": "D4",
      "decision": "Actualizar la versión documental de 1.1.0 a 1.1.1 y describir la corrección en la configuración del documento, manteniendo la fecha vigente."
    }
  ],
  "invariants": [
    "No modificar archivos fuera de docs/md/spec.md.",
    "No convertir la disponibilidad operacional en estado administrativo ni elegibilidad estructural.",
    "No cambiar el ownership comercial de las entidades de Menu ni el ownership de existencias y evaluaciones físicas de Inventory.",
    "Conservar REQ-MENU-013 como ausencia de modificadores en el modelo de Combo v1, no como prohibición.",
    "Mantener abiertos bajo OPEN-007 el transporte, los nombres de mensajes y los payloads físicos.",
    "No reintroducir el cálculo de peor caso que presupone todos los modificadores opcionales activos."
  ],
  "affected_files": [
    {
      "path": "docs/md/spec.md",
      "operation": "MODIFY",
      "instructions": [
        "Actualizar el encabezado y la sección de configuración a la versión 1.1.1, indicando que esta revisión aclara la composición efectiva OMIT/ADD y la señal lógica de capacidad de Inventory.",
        "Reformular REQ-MENU-043 para que VariantAvailability no exija satisfacer aisladamente los BaseRequirements crudos: debe existir al menos una configuración completa que respete enabled, maxQuantity y los límites minSelections/maxSelections de todos los grupos; para cada configuración candidata se parte de BaseRequirements, se aplican primero los OMIT seleccionados y después los ADD, y se evalúa la satisfacibilidad del resultado normalizado.",
        "Actualizar la verificación de REQ-MENU-043 con casos que demuestren que un ingrediente base agotado puede omitirse mediante una selección OMIT válida, que los ADD sí incrementan la demanda y que la insuficiencia conjunta de un grupo obligatorio vuelve indisponible la variante.",
        "Precisar en REQ-MENU-044 que Inventory aporta una capacidad evaluada para ModifierRequirements cuando la naturaleza cuantificable del insumo lo permite; Menu calcula availableMaxQuantity = min(configuredMaxQuantity, evaluatedCapacity). Representar el caso no aplicable como nulo/no aplicable, reservando cero para una capacidad cuantificable agotada; en el caso no aplicable, la UI usa available junto con el maxQuantity configurado.",
        "Propagar esas dos aclaraciones dentro del mismo documento a las definiciones de BaseRequirements, ModifierRequirements, VariantAvailability y ModifierAvailability; a las proyecciones de lectura; al diagrama o texto arquitectónico pertinente; al intercambio lógico de la sección 10.5; al contenido lógico consumido de Inventory en 11.2; a la tabla de dependencias de 12.1; y a las entradas de trazabilidad de REQ-MENU-043 y REQ-MENU-044.",
        "Aclarar en la publicación Menu → Inventory que BaseRequirements y ModifierRequirements siguen separados, pero conservan la información OMIT/ADD necesaria para evaluar configuraciones efectivas, sin convertir el requerimiento base crudo en una precondición independiente.",
        "Mantener la descripción del contrato en nivel lógico y neutral respecto del transporte y del esquema físico; no cerrar OPEN-007 ni introducir tecnologías, tópicos, endpoints o formatos de serialización."
      ],
      "acceptance": [
        "REQ-MENU-043 define disponibilidad por existencia de al menos una configuración efectiva válida y satisfacible, con OMIT antes de ADD.",
        "Ningún texto vigente exige satisfacer los BaseRequirements crudos antes de considerar un OMIT válido.",
        "REQ-MENU-044 y el contrato Inventory → Menu contienen una señal cuantitativa suficiente para derivar el ejemplo 2 de 3.",
        "Cero capacidad y capacidad no aplicable tienen representaciones semánticamente distintas.",
        "Glosario, requisitos, proyecciones, interfaces, mensajes, dependencias y trazabilidad dentro de spec.md expresan la misma semántica.",
        "La versión documental queda consistentemente en 1.1.1 y no se altera el ownership ni la distinción entre disponibilidad, estado administrativo y elegibilidad.",
        "Verify: Comprobar mediante búsqueda y lectura dirigida todas las apariciones de BaseRequirements, ModifierRequirements, VariantAvailability, ModifierAvailability, availableMaxQuantity, evaluatedCapacity/capacidad evaluada, OMIT, ADD y Inventory → Menu.",
        "Verify: Verificar que no permanezca una cláusula que condicione VariantAvailability a la satisfacibilidad independiente de BaseRequirements.",
        "Verify: Verificar que availableMaxQuantity tenga fórmula, fuente lógica y semántica explícita para cero y no aplicable.",
        "Verify: Confirmar que REQ-MENU-013 sigue describiendo ausencia del concepto en Combo sin lenguaje de prohibición.",
        "Verify: Comprobar que encabezado, configuración y demás menciones de versión sean coherentes y que la numeración y anclas existentes no cambien.",
        "Verify: Ejecutar git diff --check y confirmar que el delta se limite a docs/md/spec.md.",
        "La revisión textual no detecta contradicciones entre REQ-MENU-043/044 y las secciones explicativas o contractuales.",
        "La semántica puede implementarse y verificarse sin inventar un transporte o payload físico.",
        "git diff --check finaliza sin errores y no existen cambios fuera del archivo autorizado."
      ]
    }
  ],
  "blockers": []
}
