{"change_id":"create-menu-final-spec","objective":"Crear docs/md/spec.md como la especificación consolidada, vigente, autosuficiente y trazable del servicio Menu, usando exclusivamente las nueve fuentes autorizadas y respetando su evolución cronológica.","decisions":[{"id":"D-001","decision":"Crear docs/md/spec.md porque el archivo no existe en el candidato actual."},{"id":"D-002","decision":"Usar Req-F-Aproved.md como base de requisitos funcionales y Auditoria-3.md como autoridad posterior para contradicciones, refinamientos, terminología y simplificaciones."},{"id":"D-003","decision":"No crear docs/md/decisiones.md: la consolidación no debe introducir decisiones nuevas; toda cuestión no resuelta por las fuentes se registrará como abierta en spec.md."},{"id":"D-004","decision":"No consultar ni incorporar documentos enlazados desde las fuentes cuando no formen parte de la lista autorizada; sus menciones podrán conservarse únicamente como trazabilidad ya contenida en una fuente autorizada."}],"invariants":["El único archivo modificable es docs/md/spec.md.","Los nueve documentos fuente permanecen sin cambios.","Solo se utilizarán Problema-Inicial.md, Consultoria-1.md, Consultoria-2.md, Auditoria-1.md, Auditoria-2.md, Modelo-Pre-Final.md, Decisiones-cierre-invariantes.md, Req-F-Aproved.md y Auditoria-3.md, en ese orden cronológico.","Una decisión posterior sustituirá a una anterior únicamente ante contradicción explícita o refinamiento incompatible.","No se conservarán simultáneamente alternativas incompatibles ni se presentará el historial como modelo vigente.","No se inventarán requisitos, métricas, contratos, tecnologías, estados, atributos ni relaciones; los vacíos se documentarán como cuestiones abiertas.","El ownership de Orders, Inventory, POS/KDS y otros bounded contexts externos no se trasladará a Menu por el hecho de consumir o referenciar sus datos.","Requisitos, invariantes, dominio, datos, interfaces, eventos y diagramas deberán describir el mismo modelo vigente."],"affected_files":[{"path":"docs/md/spec.md","operation":"CREATE","instructions":["Redactar en español una especificación autosuficiente titulada como especificación final vigente del servicio Menu, con índice navegable y configuración documental que incluya versión, estado, fecha 2026-09-16, alcance y las nueve fuentes en orden cronológico.","Reconstruir primero las decisiones vigentes y después redactar el documento. Aplicar autoridad temporal y semántica, dejando las alternativas reemplazadas fuera del cuerpo normativo; incluirlas solo en trazabilidad cuando expliquen una modificación relevante.","Definir con claridad el alcance y lenguaje final del dominio: Menu administra la oferta comercial y sus definiciones; los productos hoja PREPARED y STOCKED utilizan MenuItemVariant, mientras COMBO utiliza ComboConfiguration, ComboSlot y ComboOption; diferenciar estado administrativo, elegibilidad estructural y disponibilidad operacional.","Consolidar Req-F-Aproved.md requisito por requisito como base. Considerar explícitamente REQ-MENU-001 a REQ-MENU-041, conservar identificadores cuando el significado continúe vigente y actualizar, sustituir o marcar como no vigente únicamente lo afectado por Auditoria-3.md. Para cada requisito final incluir obligación observable, fuente autorizada, verificación y trazabilidad de cualquier modificación respecto de la base aprobada.","Aplicar las decisiones finales de Auditoria-3.md: variante técnica DEFAULT para productos hoja sin variantes comerciales; VariantDimension y VariantValue; precio absoluto autoritativo en MenuItemVariant; Prepared resuelto mediante una revisión concreta de Recipe; Stocked resuelto mediante inventoryItemId y cantidad; modificadores propiedad del item hoja con generalConfig y VariantModifierConfig opcional; proyección ResolvedVariantModifier; efectos ADD y OMIT; Combo separado de Prepared y Stocked; ComboOption referida directamente a itemVariantId; ausencia de modificadores propios del combo en v1; precio del combo basado en ComboConfiguration.unitPrice más deltas de opciones y modificadores de componentes; categorías separadas para productos hoja y combos; y reevaluación de elegibilidad de combos dependientes al archivar variantes sin cambiar automáticamente su estado administrativo.","Reconciliar cualquier tensión entre Decisiones-cierre-invariantes.md y Auditoria-3.md aplicando la prioridad posterior de Auditoria-3.md. En particular, no conservar como vigente una regla anterior que obligue a rechazar el archivado de una variante cuando la fuente posterior exige permitirlo y reevaluar dependencias.","Documentar únicamente requisitos no funcionales respaldados por las fuentes, incluido el presupuesto de rendimiento de ADR-004 con sus condiciones, mezcla, percentiles, tasa de errores y ráfaga, distinguiendo objetivos de aceptación de resultados medidos.","Separar requisitos funcionales, requisitos no funcionales, reglas de negocio, invariantes, decisiones arquitectónicas, decisiones de UX, contratos y cuestiones abiertas. Mantener cada requisito singular, necesario, verificable y libre de detalles no respaldados.","Presentar el modelo de dominio vigente con entidades, agregados o límites cuando estén respaldados, value objects, relaciones, cardinalidades, estados, referencias externas y ownership. Añadir diagramas Mermaid solo cuando aclaren el modelo y comprobar que coincidan con el texto.","Derivar el modelo de datos del dominio consolidado, indicando identidades, revisiones inmutables, relaciones y restricciones. No introducir claves foráneas ni asociaciones persistentes entre bases de datos de bounded contexts distintos.","Consolidar interfaces de entrada y salida, eventos y dependencias externas solo al nivel confirmado por las fuentes. Distinguir definiciones y proyecciones propiedad de Menu de disponibilidad y movimientos propiedad de Inventory, y snapshots o confirmación de líneas propiedad de Orders. No inventar endpoints, códigos HTTP, payloads, transportes o garantías.","Incluir una sección de trazabilidad que permita relacionar requisitos, reglas, invariantes y decisiones principales con las fuentes autorizadas y sus secciones. No seguir enlaces hacia fuentes externas no autorizadas, aunque aparezcan dentro de Req-F-Aproved.md.","Registrar como cuestiones abiertas solo aquello no resuelto por las fuentes, incluyendo los remanentes pertinentes de OPEN-002, OPEN-007, OPEN-009 y OPEN-010 y los contratos con servicios externos. Para cada cuestión indicar problema, impacto e información faltante sin proponer una solución arbitraria.","No crear secciones vacías, no inflar la especificación con material histórico y no crear docs/md/decisiones.md ni ningún otro archivo."],"acceptance":["docs/md/spec.md existe y es el único cambio de escritura planificado.","El documento enumera exactamente las nueve fuentes autorizadas en su orden cronológico y no usa otras como autoridad.","Los 41 requisitos aprobados fueron considerados de forma comprobable; los requisitos vigentes conservan identificadores y trazabilidad, y toda modificación u obsolescencia está justificada por una fuente posterior autorizada.","El documento presenta un único modelo vigente, sin alternativas incompatibles ni contradicciones entre requisitos, invariantes, dominio, datos, interfaces, eventos y diagramas.","La terminología y ownership son consistentes, especialmente para MenuItem, MenuItemVariant, Recipe, ModifierGroup, ModifierOption, ComboConfiguration, ComboSlot, ComboOption, Orders e Inventory.","Los requisitos no funcionales y métricas reproducen únicamente valores respaldados por las fuentes y no se presentan como mediciones ejecutadas.","Las cuestiones sin decisión suficiente permanecen abiertas y no se introducen decisiones nuevas que requieran docs/md/decisiones.md.","El índice y los enlaces internos funcionan, los identificadores son únicos y las construcciones Mermaid son sintácticamente coherentes.","No se modifica ninguna fuente original, archivo protegido ni ruta fuera de docs/md/spec.md."]}],"blockers":[]}